{"$schema":"https://json-schema.org/draft/2020-12/schema","$id":"https://github.com/fisallllll280-code/VAIXLNS/blob/main/schemas/indexed-workflow-request.schema.json","title":"VAIXLNS Indexed Workflow Request","type":"object","additionalProperties":false,"required":["intent","work_type","mutation_scope","risk_level"],"properties":{"request_id":{"type":"string","minLength":1},"intent":{"type":"string","minLength":8},"work_type":{"enum":["archive_recovery","indexing","research","architecture","innovation","engineering","integration","execution","operations"]},"target_system_id":{"enum":["VAIXLNS","NEXENT","VX","XV","VV"]},"requested_capabilities":{"type":"array","uniqueItems":true,"items":{"type":"string","minLength":1}},"mutation_scope":{"enum":["NONE","DOCUMENTATION","REPOSITORY","CANONICAL","PRODUCTION","EXTERNAL"]},"risk_level":{"enum":["LOW","MEDIUM","HIGH","CRITICAL"]},"source_refs":{"type":"array","items":{"type":"string","minLength":1}},"constraints":{"type":"array","items":{"type":"string","minLength":1}},"approval_ref":{"type":"string","minLength":1},"metadata":{"type":"object"}}}