{"request_id":"WF-DEMO-RESEARCH-001","intent":"Map system and agent relationships for a capability-gap review without mutating any repository.","work_type":"architecture","target_system_id":"VAIXLNS","requested_capabilities":["capability_gap_analysis","architecture_design"],"mutation_scope":"NONE","risk_level":"LOW","source_refs":["docs/canonical/REPOSITORY_SYSTEM_MAP_V1.md","docs/agents/VAIXLNS_AGENT_OPERATING_MODEL_V1.md","registry/omega/omega-000-master-index.json"],"constraints":["preserve_provenance","do_not_invent_missing_legacy_rows","do_not_execute_external_actions"]}